{
  "schemaVersion": 1,
  "dataStatus": "legacy-migrated-with-provisional-rules",
  "notes": [
    "Migrated from the Blogger festivalData array in data/festivalData-source.txt.",
    "All 122 legacy entries are retained; original title, description/HTML links, date, endDate, statusText and hidePeriod are preserved in sourceText.",
    "Dates are copied as-is and are not verified or recalculated. date.type is manual until each festival's shastric/astronomical rule is reviewed.",
    "Do not connect this file to the live Blogger widget until validation and date-rule migration are complete.",
    "The source file also contains widget/rendering code and Chaturmas-related content outside the festivalData array; that content has not been migrated into this festival list.",
    "Added preliminary date-rule fields from festival names and a limited review of linked OurHinduDharm articles. All entries remain needs-review; these are research hints, not certified dates.",
    "sourceUrl is the first article link found in the original description HTML. No original title/description/links/date values were changed.",
    "Draft audit update 2026-10-15: festival-009 title/date wording clarified; festival-010 to festival-013 and festival-020 to festival-023 have provisional 2026 observance-date candidates from public calendar cross-checks. These remain needs-review; no production/Blogger integration is authorized by this data file alone. sourceText retains original legacy dates and descriptions for traceability.",
    "2026-10-15: Added structured relatedArticles for major autumn festivals. Where an OurHinduDharm article URL is verified, the title links to it; for Govardhan Puja and Bhai Dooj, plain-text article-topic placeholders are stored without a URL and can be linked after the articles are written. Do not invent links.",
    "2026-10-15 widget audit: parent Navaratri end date is retained only on festival-003; individual daily observance records no longer inherit 20 October as their display end. festival-009 preserves the user's clarified 18 October title and provisional 17–18 October civil-date span; exact tithi instants/observance rule remain unverified."
  ],
  "festivals": [
    {
      "id": "festival-001",
      "name": "आश्विन कृष्ण प्रतिपदा (पितृपक्ष प्रारंभ)",
      "date": {
        "type": "tithi",
        "start": "2026-09-27",
        "end": "2026-10-10",
        "calculationNotes": "Legacy Blogger date copied unchanged; astronomical/tithi rule not yet reviewed. प्रारंभिक नियम; लेख/स्थानीय पंचांग से पूर्ण सत्यापन शेष।",
        "tithi": "कृष्ण प्रतिपदा",
        "month": "आश्विन/भाद्रपद",
        "rule": "पितृपक्ष आरम्भ; पूर्णिमांत/अमांत मास-नाम और स्थानीय श्राद्ध-निर्णय सत्यापित करें।"
      },
      "description": "<a href=\"http://ourhindudharm.blogspot.com/2013/09/About-Shraaddhs-and-Pitripaksha-on-Mahalaya.html\" target=\"_blank\">प्रतिपदा का श्राद्ध, श्राद्ध प्रारंभ, महालय , पितृपक्ष प्रारंभ</a> - पितृपक्ष 10 अक्टूबर (सर्वपितृ अमावस्या) तक रहेगा।",
      "statusText": "पितृपक्ष चल रहा है",
      "sourceText": {
        "date": "2026-09-27",
        "endDate": "2026-10-10",
        "statusText": "पितृपक्ष चल रहा है",
        "title": "आश्विन कृष्ण प्रतिपदा (पितृपक्ष प्रारंभ)",
        "description": "<a href=\"http://ourhindudharm.blogspot.com/2013/09/About-Shraaddhs-and-Pitripaksha-on-Mahalaya.html\" target=\"_blank\">प्रतिपदा का श्राद्ध, श्राद्ध प्रारंभ, महालय , पितृपक्ष प्रारंभ</a> - पितृपक्ष 10 अक्टूबर (सर्वपितृ अमावस्या) तक रहेगा।"
      },
      "sourceUrl": "http://ourhindudharm.blogspot.com/2013/09/About-Shraaddhs-and-Pitripaksha-on-Mahalaya.html",
      "verificationStatus": "needs-review"
    },
    {
      "id": "festival-002",
      "name": "पितृ विसर्जन अमावास्या",
      "date": {
        "type": "tithi",
        "start": "2026-10-10",
        "end": null,
        "calculationNotes": "Legacy Blogger date copied unchanged; astronomical/tithi rule not yet reviewed. प्रारंभिक नियम; लेख/स्थानीय पंचांग से पूर्ण सत्यापन शेष।",
        "tithi": "कृष्ण अमावस्या",
        "month": "आश्विन",
        "rule": "सर्वपितृ अमावस्या; श्राद्ध/तर्पण के लिए अमावस्या-व्याप्ति और कुतुप/रौहिण मुहूर्त जैसे स्थानीय नियम जाँचें।"
      },
      "description": "पितृपक्ष पर <a href=\"https://ourhindudharm.blogspot.com/p/pitri-tarpan-vidhi.html\" target=\"_blank\">पितृ तर्पण विधि</a> एवं <a href=\"https://ourhindudharm.blogspot.com/p/pitri-visarjan.html\" target=\"_blank\">पितृ विसर्जन विधि</a>",
      "sourceText": {
        "date": "2026-10-10",
        "title": "पितृ विसर्जन अमावास्या",
        "description": "पितृपक्ष पर <a href=\"https://ourhindudharm.blogspot.com/p/pitri-tarpan-vidhi.html\" target=\"_blank\">पितृ तर्पण विधि</a> एवं <a href=\"https://ourhindudharm.blogspot.com/p/pitri-visarjan.html\" target=\"_blank\">पितृ विसर्जन विधि</a>"
      },
      "sourceUrl": "https://ourhindudharm.blogspot.com/p/pitri-tarpan-vidhi.html",
      "verificationStatus": "needs-review"
    },
    {
      "id": "festival-003",
      "name": "शारदीय नवरात्र प्रारम्भ",
      "date": {
        "type": "tithi",
        "start": "2026-10-11",
        "end": "2026-10-20",
        "calculationNotes": "Legacy Blogger date copied unchanged; astronomical/tithi rule not yet reviewed. प्रारंभिक नियम; लेख/स्थानीय पंचांग से पूर्ण सत्यापन शेष।",
        "tithi": "आश्विन शुक्ल प्रतिपदा",
        "month": "आश्विन",
        "rule": "प्रतिपदा से नवमी तक नवरात्र; स्थापना के लिए प्रतिपदा और प्रातःकाल/अभिजित आदि नियम अलग से जाँचें।"
      },
      "description": "<a href=\"http://ourhindudharm.blogspot.com/2013/10/About-Sharadiya-Navaratri.html\" target=\"_blank\">शारदीय नवरात्र प्रारम्भ</a> (आश्विन शुक्ल प्रतिपदा) <a href=\"https://ourhindudharm.blogspot.com/p/kalash-sthapan.html\">घटस्थापना (संपूर्ण विधि)</a>कलश स्थापना मुहूर्त: चयनित शहर के स्थानीय सूर्योदय, प्रतिपदा-व्याप्ति और नियमों से गणना करके दिखाएँ। अभिजित मुहूर्त वैकल्पिक है; चित्रा नक्षत्र/वैधृति योग के बारे में परंपरा-आधारित चेतावनी दिखाएँ। घटस्थापन और पूजा के लिए विशेष शुभ समय अपने शहर के अनुसार - <a href=\"https://ourhindudharm.blogspot.com/p/panchang-today.html\">हमारे पंचांग पृष्ठ में जाकर देखें</a> <br/>*<a href=\"http://ourhindudharm.blogspot.com/2013/10/About-Shailputriji-On-FirstDay-OfNavaratri.html\" target=\"_blank\"> प्रथमं शैलपुत्री च </a>",
      "statusText": "नवरात्रि चल रही है",
      "sourceText": {
        "date": "2026-10-11",
        "endDate": "2026-10-20",
        "statusText": "नवरात्रि चल रही है",
        "title": "शारदीय नवरात्र प्रारम्भ",
        "description": "<a href=\"http://ourhindudharm.blogspot.com/2013/10/About-Sharadiya-Navaratri.html\" target=\"_blank\">शारदीय नवरात्र प्रारम्भ</a> (आश्विन शुक्ल प्रतिपदा) <a href=\"https://ourhindudharm.blogspot.com/p/kalash-sthapan.html\">घटस्थापना (संपूर्ण विधि)</a>कलश स्थापना मुहूर्त - 06:19 ए एम से 10:12 ए एम तक। अभिजित मुहूर्त - दिन - 11:32 am से 12:18 pm तक | जहाँ तक संभव हो चित्रा नक्षत्र व वैधृति योग टालकर ही कलश स्थापित करें, टालना असंभव हो तो अभिजित मुहूर्त पर करें। घटस्थापन और पूजा के लिए विशेष शुभ समय अपने शहर के अनुसार - <a href=\"https://ourhindudharm.blogspot.com/p/panchang-today.html\">हमारे पंचांग पृष्ठ में जाकर देखें</a> <br/>*<a href=\"http://ourhindudharm.blogspot.com/2013/10/About-Shailputriji-On-FirstDay-OfNavaratri.html\" target=\"_blank\"> प्रथमं शैलपुत्री च </a>"
      },
      "sourceUrl": "http://ourhindudharm.blogspot.com/2013/10/About-Sharadiya-Navaratri.html",
      "verificationStatus": "needs-review",
      "muhurtaPlan": {
        "type": "ghatasthapana",
        "calculation": "local-dynamic",
        "requiredInputs": [
          "sunrise",
          "sunset",
          "pratipadaStart",
          "pratipadaEnd",
          "abhijitWindow",
          "chitraInterval",
          "vaidhritiInterval"
        ],
        "ruleProfile": "classical-ghatasthapana-first-third-of-day; abhijit-fallback",
        "displayLabel": "घटस्थापना मुहूर्त",
        "status": "needs-calculation"
      },
      "relatedArticles": [
        {
          "title": "शारदीय नवरात्र की जानकारी",
          "url": "http://ourhindudharm.blogspot.com/2013/10/About-Sharadiya-Navaratri.html"
        },
        {
          "title": "घटस्थापना की संपूर्ण विधि",
          "url": "https://ourhindudharm.blogspot.com/p/kalash-sthapan.html"
        },
        {
          "title": "आज का पंचांग",
          "url": "https://ourhindudharm.blogspot.com/p/panchang-today.html"
        },
        {
          "title": "माँ शैलपुत्री की पूजा",
          "url": "http://ourhindudharm.blogspot.com/2013/10/About-Shailputriji-On-FirstDay-OfNavaratri.html"
        }
      ]
    },
    {
      "id": "festival-004",
      "name": "शारदीय नवरात्र द्वितीया - ब्रह्मचारिणी",
      "date": {
        "type": "tithi",
        "start": "2026-10-12",
        "end": null,
        "calculationNotes": "Legacy Blogger date copied unchanged; astronomical/tithi rule not yet reviewed. प्रारंभिक नियम; लेख/स्थानीय पंचांग से पूर्ण सत्यापन शेष।",
        "tithi": null,
        "month": null,
        "rule": "नवरात्र के क्रमांकित दिन की तिथि; मूल कैलेंडर तारीख को तिथि-आरम्भ/समाप्ति और स्थानीय व्रत-निर्णय से सत्यापित करें।"
      },
      "description": "<a href=\"http://ourhindudharm.blogspot.com/2013/10/About-Brahmacharini-Ma-On-Navaratri.html\" target=\"_blank\">द्वितीयं ब्रह्मचारिणी</a>",
      "hidePeriod": true,
      "sourceText": {
        "date": "2026-10-12",
        "endDate": "2026-10-20",
        "hidePeriod": true,
        "title": "शारदीय नवरात्र द्वितीया - ब्रह्मचारिणी",
        "description": "<a href=\"http://ourhindudharm.blogspot.com/2013/10/About-Brahmacharini-Ma-On-Navaratri.html\" target=\"_blank\">द्वितीयं ब्रह्मचारिणी</a>"
      },
      "sourceUrl": "http://ourhindudharm.blogspot.com/2013/10/About-Brahmacharini-Ma-On-Navaratri.html",
      "verificationStatus": "needs-review"
    },
    {
      "id": "festival-005",
      "name": "शारदीय नवरात्र तृतीया - चन्द्रघंटा",
      "date": {
        "type": "tithi",
        "start": "2026-10-13",